{
  "schema_version": 1,
  "manifest_id": "synthetic-metal-baseline-v1",
  "comparison_id": "synthetic-metal-engine-comparison-v1",
  "arm": "baseline",
  "lane_id": "synthetic_candle_metal",
  "evidence_class": "synthetic",
  "allowed_differences": ["runtime.engine", "runtime.toolchain"],
  "workload": {
    "job_type": "batch_infer",
    "model": {
      "id": "llama-3.2-1b-instruct-q4",
      "revision": "fixture-revision-1",
      "weights_sha256": "1111111111111111111111111111111111111111111111111111111111111111",
      "tokenizer_sha256": "2222222222222222222222222222222222222222222222222222222222222222"
    },
    "precision": {
      "compute_dtype": "f16",
      "weight_dtype": "q4_k_m",
      "accumulator_dtype": "f32",
      "quantization": {
        "scheme": "q4_k_m",
        "bits": 4,
        "group_size": 32,
        "calibration_sha256": "abababababababababababababababababababababababababababababababab"
      }
    },
    "prompt_corpus": {
      "id": "synthetic-prompts-v1",
      "sha256": "3333333333333333333333333333333333333333333333333333333333333333",
      "record_count": 20,
      "format": "jsonl-utf8-lf"
    },
    "output": {
      "requested_tokens_per_prompt": 64,
      "include_prompt_tokens": false,
      "stop_conditions_sha256": "4444444444444444444444444444444444444444444444444444444444444444",
      "throughput_unit": "output_token"
    },
    "batch": {
      "mode": "fixed",
      "batch_size": 4,
      "max_batch_size": 4,
      "max_wait_ms": 0,
      "padding": "right-longest",
      "ordering": "corpus-order"
    }
  },
  "runtime": {
    "engine": {
      "name": "synthetic-baseline-engine",
      "version": "1.0.0-fixture",
      "build_sha256": "5555555555555555555555555555555555555555555555555555555555555555"
    },
    "agent": {
      "name": "cx-agent",
      "version": "0.1.0-fixture",
      "build_sha256": "6666666666666666666666666666666666666666666666666666666666666666"
    },
    "toolchain": [
      {
        "name": "rustc",
        "version": "1.84.0-fixture-baseline",
        "build_sha256": "7777777777777777777777777777777777777777777777777777777777777777"
      }
    ]
  },
  "hardware": {
    "host_id_sha256": "8888888888888888888888888888888888888888888888888888888888888888",
    "sku": "synthetic-apple-m3-pro-18gpu",
    "accelerator_count": 1,
    "accelerator_memory_gb": 18,
    "system_memory_gb": 36,
    "cpu": "synthetic-apple-m3-pro",
    "os": "synthetic-macos",
    "os_version": "fixture-1.0",
    "driver": "fixture-metal-integrated-1",
    "firmware": "fixture-firmware-1"
  },
  "environment": {
    "power": {
      "source": "ac",
      "mode": "synthetic-normal-power",
      "limit_watts": 45,
      "measurement_source": "synthetic-power-meter"
    },
    "thermal": {
      "state": "nominal",
      "temperature_c": 50,
      "sensor": "synthetic-package-sensor",
      "fan_policy": "synthetic-automatic"
    },
    "competing_load": {
      "policy": "idle",
      "process_snapshot_sha256": "9999999999999999999999999999999999999999999999999999999999999999",
      "cpu_utilization_pct": 2,
      "gpu_utilization_pct": 0,
      "memory_used_gb": 4
    }
  },
  "timing_scope": {
    "provisioning_included": true,
    "queue_included": true,
    "transfer_in_included": true,
    "transfer_out_included": true,
    "clock": "synthetic-monotonic-nanoseconds",
    "start_boundary": "provision-request",
    "end_boundary": "verified-output-received-and-cleanup-complete"
  },
  "sampling": {
    "warmup_iterations": 3,
    "measured_iterations": 20,
    "order": "interleaved_ab_ba",
    "seed": 20260710
  },
  "regression_policy": {
    "min_throughput_ratio": 0.95,
    "max_p95_latency_ratio": 1.1,
    "max_p99_latency_ratio": 1.15,
    "max_oom_events": 0,
    "max_restart_events": 0,
    "max_disconnect_events": 0,
    "max_corrupt_output_events": 0,
    "max_cleanup_failures": 0,
    "require_cleanup": true
  }
}
